id,head,name,age,sex,info,fail_word
1,boy000.png,崔教练,26,男,著名健身会所教练，热爱体育运动，对异性的健康和体型方面有要求，并且十分注重养生。,气球，我这边还有学员需要辅导，下次有空多来会所吧，拜拜。
2,boy001.png,张立毅,23,男,特种警察，在一次执行任务的过程里偶遇并互相留下联系方式，性格比较内敛谨慎，欣赏有智慧及勇气的异性。,气球，我这边还有些事情要办，下次再聊吧。
3,boy002.png,Micro,25,男,上周刚搬来成为自己的新邻居。在中国已经居住了五年时间，为人幽默风趣，喜欢烹饪，对开朗热情的异性有好感，现在担任著名大学的外语教师。,气球，我这边还有些事情要办，不打扰你了。
4,boy003.png,夜曲,22,男,酒吧驻唱歌手，帅气性感的形象让他成为拥有一片忠实粉丝的捧场，好不容易才拿到他的联系方式但一直没交流过，欣赏和他一样有音乐梦想的异性。,气球，我还要完成今晚演奏的曲谱，下次再聊吧。
5,boy004.png,陆医生,27,男,本市甲级医院的牙科医生，之前因为蛀牙问题所以跟他有了接触，性格温柔斯文对待每一位病人都非常有耐性，喜欢与自己性格相反的异性。,气球，我今天要治疗的病人比较多，下次再聊吧。
